{
  "id": "anime-en-basic",
  "version": "2.0.0",
  "name": {
    "en": "Anime English",
    "zh": "动漫英文版"
  },
  "description": {
    "en": "Real anime/manga character naming patterns from popular anime, VTubers, and mascots (1-4 words)",
    "zh": "基于热门动漫、VTuber、吉祥物的真实角色命名模式（1-4个单词）"
  },
  "style": "anime",
  "languages": [
    "en"
  ],
  "algorithm": "template",
  "platformOptimized": [
    "discord",
    "twitch",
    "youtube"
  ],
  "author": {
    "name": "Bot Name Generator Team",
    "github": "pick-bot-name"
  },
  "license": "MIT",
  "tags": [
    "anime",
    "vtuber",
    "mascot",
    "japanese"
  ],
  "data": {
    "templates": [
      "{name}",
      "{name} {suffix}",
      "{adj} {name}",
      "{name} {name}"
    ],
    "vocabulary": {
      "name": [
        { "value": "Luna", "weight": 10 },
        { "value": "Stella", "weight": 10 },
        { "value": "Nova", "weight": 9 },
        { "value": "Kira", "weight": 9 },
        { "value": "Hoshi", "weight": 9 },
        { "value": "Yuki", "weight": 9 },
        { "value": "Sora", "weight": 8 },
        { "value": "Aoi", "weight": 8 },
        { "value": "Mochi", "weight": 8 },
        { "value": "Neko", "weight": 8 },
        { "value": "Mimi", "weight": 7 },
        { "value": "Coco", "weight": 7 },
        { "value": "Nana", "weight": 7 },
        { "value": "Riri", "weight": 7 },
        { "value": "Chibi", "weight": 6 },
        { "value": "Fuwa", "weight": 6 }
      ],
      "suffix": [
        { "value": "chan", "weight": 10 },
        { "value": "kun", "weight": 8 },
        { "value": "san", "weight": 6 }
      ],
      "adj": [
        { "value": "Star", "weight": 10 },
        { "value": "Moon", "weight": 9 },
        { "value": "Dream", "weight": 8 },
        { "value": "Sweet", "weight": 8 },
        { "value": "Cute", "weight": 7 },
        { "value": "Magic", "weight": 7 }
      ]
    }
  },
  "examples": [
    "Luna",
    "Stella",
    "Kira",
    "Luna chan",
    "Yuki kun",
    "Star Nova",
    "Mochi Neko",
    "Sweet Mimi"
  ]
}
