{
  "id": "minimal-en-basic",
  "version": "2.1.0",
  "name": {
    "en": "Minimal English",
    "zh": "极简英文版"
  },
  "description": {
    "en": "Ultra-minimal English bot names with simple and abstract patterns (1-2 words)",
    "zh": "极简抽象的英文机器人名称，简洁而现代（1-2个单词）"
  },
  "style": "minimal",
  "languages": [
    "en"
  ],
  "algorithm": "template",
  "platformOptimized": [
    "telegram",
    "discord",
    "slack"
  ],
  "author": {
    "name": "Bot Name Generator Team",
    "github": "pick-bot-name"
  },
  "license": "MIT",
  "tags": [
    "minimal",
    "english",
    "simple",
    "clean"
  ],
  "data": {
    "templates": [
      { "value": "{word}", "weight": 10 },
      { "value": "{adj} {noun}", "weight": 8 },
      { "value": "{noun} Bot", "weight": 6 }
    ],
    "vocabulary": {
      "word": [
        { "value": "Echo", "weight": 10 },
        { "value": "Beam", "weight": 10 },
        { "value": "Drift", "weight": 9 },
        { "value": "Flux", "weight": 9 },
        { "value": "Glide", "weight": 9 },
        { "value": "Pivot", "weight": 8 },
        { "value": "Trace", "weight": 8 },
        { "value": "Prism", "weight": 8 },
        { "value": "Clarity", "weight": 7 },
        { "value": "Simplify", "weight": 7 },
        { "value": "Aide", "weight": 7 },
        { "value": "Prompt", "weight": 6 },
        { "value": "Brief", "weight": 6 }
      ],
      "adj": [
        { "value": "Quick", "weight": 10 },
        { "value": "Smart", "weight": 10 },
        { "value": "Pure", "weight": 9 },
        { "value": "Clean", "weight": 9 },
        { "value": "Swift", "weight": 8 },
        { "value": "Clear", "weight": 8 },
        { "value": "Plain", "weight": 7 },
        { "value": "Neat", "weight": 7 },
        { "value": "Calm", "weight": 6 },
        { "value": "Crisp", "weight": 6 }
      ],
      "noun": [
        { "value": "Help", "weight": 10 },
        { "value": "Aid", "weight": 10 },
        { "value": "Guide", "weight": 9 },
        { "value": "Assist", "weight": 9 },
        { "value": "Reply", "weight": 8 },
        { "value": "Answer", "weight": 8 },
        { "value": "Talk", "weight": 7 },
        { "value": "Chat", "weight": 7 },
        { "value": "Link", "weight": 6 },
        { "value": "Task", "weight": 6 }
      ]
    }
  },
  "examples": [
    "Echo",
    "Beam",
    "Drift",
    "Quick Help",
    "Smart Aid",
    "Pure Guide",
    "Help Bot",
    "Chat Bot"
  ]
}
