{
  "id": "punk-zh-basic",
  "version": "1.0.0",
  "name": {
    "en": "Punk Chinese Basic",
    "zh": "朋克中文基础版"
  },
  "description": {
    "en": "Basic punk-style bot names in Chinese",
    "zh": "基础的中文朋克风格机器人名称"
  },
  "style": "punk",
  "languages": [
    "zh"
  ],
  "algorithm": "combination",
  "platformOptimized": [
    "telegram",
    "discord",
    "qq"
  ],
  "author": {
    "name": "Bot Name Generator Team",
    "github": "pick-bot-name"
  },
  "license": "MIT",
  "tags": [
    "punk",
    "chinese",
    "tech",
    "futuristic"
  ],
  "data": {
    "prefixes": [
      {
        "value": "赛博",
        "weight": 10
      },
      {
        "value": "量子",
        "weight": 9
      },
      {
        "value": "神经",
        "weight": 8
      },
      {
        "value": "数字",
        "weight": 7
      },
      {
        "value": "矩阵",
        "weight": 6
      }
    ],
    "roots": [
      {
        "value": "核",
        "weight": 10
      },
      {
        "value": "网",
        "weight": 9
      },
      {
        "value": "脉",
        "weight": 8
      },
      {
        "value": "波",
        "weight": 7
      },
      {
        "value": "X",
        "weight": 6
      }
    ],
    "suffixes": [
      {
        "value": "",
        "weight": 10
      },
      {
        "value": "X",
        "weight": 8
      },
      {
        "value": "版",
        "weight": 6
      }
    ]
  },
  "examples": [
    "赛博核",
    "量子X",
    "神经网",
    "数字脉",
    "矩阵波"
  ]
}
