{
  "id": "minimal-zh-basic",
  "version": "2.2.0",
  "name": {
    "en": "Minimal Chinese",
    "zh": "极简中文版"
  },
  "description": {
    "en": "Ultra-minimal Chinese bot names with natural 2-character words",
    "zh": "极简自然的中文机器人名称，使用常见2字词汇"
  },
  "style": "minimal",
  "languages": [
    "zh"
  ],
  "algorithm": "template",
  "platformOptimized": [
    "weixin",
    "wecom",
    "feishu"
  ],
  "author": {
    "name": "Bot Name Generator Team",
    "github": "pick-bot-name"
  },
  "license": "MIT",
  "tags": [
    "minimal",
    "chinese",
    "simple",
    "clean"
  ],
  "data": {
    "templates": [
      "{word}",
      "{word}{word}"
    ],
    "vocabulary": {
      "word": [
        { "value": "答答", "weight": 10 },
        { "value": "问问", "weight": 10 },
        { "value": "助助", "weight": 9 },
        { "value": "应答", "weight": 9 },
        { "value": "快答", "weight": 9 },
        { "value": "易答", "weight": 8 },
        { "value": "轻助", "weight": 8 },
        { "value": "简应", "weight": 8 },
        { "value": "明答", "weight": 7 },
        { "value": "清语", "weight": 7 },
        { "value": "纯言", "weight": 7 },
        { "value": "速答", "weight": 7 },
        { "value": "即答", "weight": 6 },
        { "value": "秒回", "weight": 6 },
        { "value": "即应", "weight": 6 },
        { "value": "通达", "weight": 6 },
        { "value": "直答", "weight": 5 },
        { "value": "明语", "weight": 5 },
        { "value": "简答", "weight": 5 },
        { "value": "易问", "weight": 5 }
      ]
    }
  },
  "examples": [
    "答答",
    "问问",
    "助助",
    "应答",
    "快答",
    "易答",
    "秒回",
    "即答"
  ]
}
