{
  "id": "acgn-en-basic",
  "version": "2.0.0",
  "name": {
    "en": "ACGN English",
    "zh": "二次元英文版"
  },
  "description": {
    "en": "Real ACGN character naming patterns from anime, games, visual novels, and VTubers (1-4 words)",
    "zh": "基于动漫、游戏、视觉小说、虚拟主播的真实二次元角色命名（1-4个单词）"
  },
  "style": "acgn",
  "languages": [
    "en"
  ],
  "algorithm": "template",
  "platformOptimized": [
    "discord",
    "twitch",
    "youtube"
  ],
  "author": {
    "name": "Bot Name Generator Team",
    "github": "pick-bot-name"
  },
  "license": "MIT",
  "tags": [
    "acgn",
    "anime",
    "otaku",
    "vtuber"
  ],
  "data": {
    "templates": [
      { "value": "{name}", "weight": 10 },
      { "value": "{name} {suffix}", "weight": 9 },
      { "value": "{trait} {name}", "weight": 7 },
      { "value": "{name} {role}", "weight": 8 }
    ],
    "vocabulary": {
      "name": [
        { "value": "Hoshino", "weight": 10 },
        { "value": "Yukina", "weight": 10 },
        { "value": "Sakura", "weight": 9 },
        { "value": "Tsuki", "weight": 9 },
        { "value": "Haruka", "weight": 9 },
        { "value": "Rin", "weight": 8 },
        { "value": "Yui", "weight": 8 },
        { "value": "Mio", "weight": 8 },
        { "value": "Nana", "weight": 8 },
        { "value": "Akari", "weight": 7 },
        { "value": "Shiro", "weight": 7 },
        { "value": "Hana", "weight": 7 },
        { "value": "Ai", "weight": 7 },
        { "value": "Mei", "weight": 6 },
        { "value": "Nene", "weight": 6 }
      ],
      "suffix": [
        { "value": "chan", "weight": 10 },
        { "value": "kun", "weight": 8 },
        { "value": "sama", "weight": 6 },
        { "value": "senpai", "weight": 5 }
      ],
      "trait": [
        { "value": "Tsundere", "weight": 10 },
        { "value": "Yandere", "weight": 8 },
        { "value": "Kuudere", "weight": 7 },
        { "value": "Dandere", "weight": 6 },
        { "value": "Genki", "weight": 8 },
        { "value": "Kawaii", "weight": 9 }
      ],
      "role": [
        { "value": "Idol", "weight": 10 },
        { "value": "Mage", "weight": 8 },
        { "value": "Knight", "weight": 7 },
        { "value": "Priestess", "weight": 6 }
      ]
    }
  },
  "examples": [
    "Hoshino",
    "Yukina",
    "Sakura chan",
    "Rin kun",
    "Tsundere Hana",
    "Kawaii Yui",
    "Haruka Idol",
    "Ai Mage"
  ]
}
