{
  "id": "acgn-zh-basic",
  "version": "1.0.0",
  "name": {
    "en": "ACGN Chinese Basic",
    "zh": "二次元中文基础版"
  },
  "description": {
    "en": "ACGN (Anime, Comic, Game, Novel) style bot names in Chinese",
    "zh": "二次元(动画、漫画、游戏、小说)风格的中文机器人名称"
  },
  "style": "acgn",
  "languages": [
    "zh"
  ],
  "algorithm": "combination",
  "platformOptimized": [
    "qq",
    "qqbot",
    "bilibili"
  ],
  "author": {
    "name": "Bot Name Generator Team",
    "github": "pick-bot-name"
  },
  "license": "MIT",
  "tags": [
    "acgn",
    "chinese",
    "anime",
    "otaku"
  ],
  "data": {
    "prefixes": [
      {
        "value": "萌",
        "weight": 10
      },
      {
        "value": "元气",
        "weight": 9
      },
      {
        "value": "治愈",
        "weight": 8
      },
      {
        "value": "宅",
        "weight": 7
      },
      {
        "value": "二次元",
        "weight": 6
      }
    ],
    "roots": [
      {
        "value": "酱",
        "weight": 10
      },
      {
        "value": "喵",
        "weight": 9
      },
      {
        "value": "君",
        "weight": 8
      },
      {
        "value": "姬",
        "weight": 7
      },
      {
        "value": "娘",
        "weight": 6
      }
    ],
    "suffixes": [
      {
        "value": "",
        "weight": 10
      },
      {
        "value": "喵",
        "weight": 8
      },
      {
        "value": "呆",
        "weight": 7
      }
    ]
  },
  "examples": [
    "萌酱",
    "元气喵",
    "治愈君",
    "宅姬",
    "二次元娘"
  ]
}
