{
  "id": "professional-en-corporate",
  "version": "3.0.0",
  "name": {
    "en": "Professional English",
    "zh": "专业英文版"
  },
  "description": {
    "en": "Real-world professional bot names based on GitHub, Probot, and enterprise tools (2-4 words)",
    "zh": "基于GitHub、Probot等真实企业工具的专业机器人命名（2-4个单词）"
  },
  "style": "professional",
  "languages": [
    "en"
  ],
  "algorithm": "template",
  "platformOptimized": [
    "slack",
    "github",
    "gitlab",
    "teams"
  ],
  "author": {
    "name": "Bot Name Generator Team",
    "github": "pick-bot-name"
  },
  "license": "MIT",
  "tags": [
    "professional",
    "development",
    "devops",
    "github",
    "probot"
  ],
  "data": {
    "templates": [
      { "value": "{function} {type}", "weight": 10 },
      { "value": "{adj} {function} {type}", "weight": 7 },
      { "value": "{function} {action}", "weight": 9 },
      { "value": "{adj} {function} {action}", "weight": 6 }
    ],
    "vocabulary": {
      "function": [
        { "value": "Code", "weight": 10 },
        { "value": "Deploy", "weight": 10 },
        { "value": "Test", "weight": 10 },
        { "value": "Release", "weight": 9 },
        { "value": "Build", "weight": 9 },
        { "value": "Merge", "weight": 9 },
        { "value": "Review", "weight": 9 },
        { "value": "Issue", "weight": 8 },
        { "value": "PR", "weight": 8 },
        { "value": "Security", "weight": 8 },
        { "value": "Performance", "weight": 7 },
        { "value": "Container", "weight": 7 },
        { "value": "API", "weight": 7 },
        { "value": "Database", "weight": 7 },
        { "value": "Log", "weight": 6 },
        { "value": "CI", "weight": 6 },
        { "value": "Pipeline", "weight": 6 },
        { "value": "Branch", "weight": 6 },
        { "value": "Workflow", "weight": 6 },
        { "value": "Team", "weight": 5 }
      ],
      "type": [
        { "value": "Bot", "weight": 10 },
        { "value": "Helper", "weight": 9 },
        { "value": "Assistant", "weight": 9 },
        { "value": "Runner", "weight": 8 },
        { "value": "Manager", "weight": 7 },
        { "value": "Monitor", "weight": 7 },
        { "value": "Checker", "weight": 6 },
        { "value": "Scanner", "weight": 6 },
        { "value": "Agent", "weight": 5 }
      ],
      "action": [
        { "value": "Review", "weight": 10 },
        { "value": "Drafter", "weight": 9 },
        { "value": "Checker", "weight": 9 },
        { "value": "Runner", "weight": 8 },
        { "value": "Triage", "weight": 8 },
        { "value": "Labeler", "weight": 7 },
        { "value": "Assigner", "weight": 7 },
        { "value": "Analyzer", "weight": 6 },
        { "value": "Detector", "weight": 6 }
      ],
      "adj": [
        { "value": "Smart", "weight": 10 },
        { "value": "Auto", "weight": 10 },
        { "value": "Automated", "weight": 9 },
        { "value": "Continuous", "weight": 7 },
        { "value": "Quick", "weight": 6 },
        { "value": "Fast", "weight": 6 }
      ]
    }
  },
  "examples": [
    "Code Review",
    "Deploy Bot",
    "Test Runner",
    "Release Drafter",
    "Smart Code Assistant",
    "Auto Merge Bot",
    "Automated Test Runner"
  ]
}
